{
  "name": "Hassan",
  "emails": [
    "hello@waquar.com"
  ],
  "phones": [
    "+91 8271981162"
  ],
  "summary": "",
  "skills": [
    "August 2024 – present",
    "New Delhi",
    "August 2019 – August 2022",
    "Noida",
    "March 2017 – March 2019",
    "Siwan",
    "Bihar",
    "Programming",
    "Python",
    "Dart",
    "JavaScript",
    "C++",
    "SQL",
    "MVC",
    "Web",
    "react.js",
    "node.js",
    "aws",
    "streamlit",
    "Mobile",
    "Flutter",
    "Android and iOS Development",
    "Tools",
    "Git",
    "Firebase",
    "Jira",
    "CVAT",
    "MS Excel",
    "Vercel",
    "Mixpanel"
  ],
  "education": [
    "Jamia Millia Islamia, M.Sc (Artificial Intelligence and Machince Learning)",
    "Institute of Management Studies (IMS), Bachelor of Computer Applications (BCA)",
    "C.B.I Inter College, Intermediate"
  ],
  "experience": [],
  "projects": [
    "NearKart,",
    "An application that helps users find nearby vendors along with their location, available items, prices, and ratings",
    "•An application that helps users find nearby vendors along with their location, available items, prices, and ratings",
    "•Available on both the Play Store and App Store.",
    "•Provides real-time vendor location tracking for a seamless experience.",
    "SoftRetic, Complete Web Challenges - 2021",
    "AWS Educate, Introduction to RPA - 2020",
    "AWARDS"
  ],
  "raw_text": "Waquar Hassan\n\nhello@waquar.com \n\nJamia Nagar, New Delhi 110025 \n\n+91 8271981162 \n\nwaquar.com \n\nLinkedIn \n\nGitHub \n\nAugust 2023 –\nJanuary 2024\n\nWebreinvent Technologies, Software Developer Trainee\nAt Toolstation (UK client):\n\nPROFESSIONAL EXPERIENCE\n\n•Managed the frontend codebase, integrated services like DataDog, Bloomreach CMS, \nand Lokalise, and implemented a payment gateway.\n•Maintained MVC Code Architecture.\n•Fixed bugs to improve app performance by 10%.\n•Wrote unit tests and documentation, saving future developers time and making \nonboarding 50% easier.\n\nOn internal projects:\n\n•Integrated Firebase Authentication, Storage, and Cloud Firestore.\n•Worked on MVC Code Architecture. \n•Incorporated notifications using OneSignal.\n•Built scalable UIs that can adapt to future changes.\n\nEDUCATION\n\nJamia Millia Islamia, M.Sc (Artificial Intelligence and Machince Learning)\n\nInstitute of Management Studies (IMS), Bachelor of Computer Applications (BCA)\n\nC.B.I Inter College, Intermediate\n\nSKILLS\n\nAugust 2024 – present\nNew Delhi\n\nAugust 2019 – August 2022\nNoida\n\nMarch 2017 – March 2019\nSiwan, Bihar,\n\nProgramming\nPython, Dart, JavaScript, C++, SQL, MVC\n\nWeb\nreact.js, node.js, aws, streamlit\n\nMobile\nFlutter, Android and iOS Development\n\nTools\nGit, Firebase, Jira, CVAT, MS Excel, Vercel, Mixpanel\n\nPROJECTS\n\nNearKart, \nAn application that helps users find nearby vendors along with their location, available items, prices, and ratings\n\n•An application that helps users find nearby vendors along with their location, available items, prices, and ratings\n•Available on both the Play Store and App Store.\n•Provides real-time vendor location tracking for a seamless experience.\n\nSoftRetic, Complete Web Challenges - 2021\n\nAWS Educate, Introduction to RPA - 2020\n\nAWARDS\n\n\f"
}